{
  "registry_contract_version":"ml_registry_document_v1","registry_kind":"indicators",
  "entry_defaults":{"registry_contract_version":"ml_registry_entry_v1","aliases":[],"category":"INDICATOR","implementation_status":"IMPLEMENTED_AND_BOUNDED_RUNNABLE","config_owner":"config/selector_features","target_contract":null,"model_role":"feature","research_only":true,"point_in_time_requirements":"source observations strictly precede the decision timestamp","worker_support":"feature builder workers","seed_support":"not_applicable","checkpoint_support":"none","bounded_runner_support":true,"ordinary_runner_support":true,"dependency_requirements":[],"notes":"Existing canonical-v2 selector input.","source_fields":["daily price/volume history"],"source_dataset":"canonical-v2 daily stock history","lookback":"field-specific trailing window","calculation_equation":"momentum_return","available_timestamp_rule":"available only after all source sessions precede decision_session_date","point_in_time_safe":true,"unit":"numeric","data_type":"double","missingness_policy":"median imputation fitted on training rows only","allowed_roles":["selector","linear selector","sequence selector"],"feature_schema_membership":["canonical_v2_daily_tabular_v1"]},
  "entries":[
    {"canonical_id":"predicted_momentum_20d","display_name":"Predicted momentum 20d","implementation_owner":"core.research.ml.stock_level.selector_dataset","lookback":"20 sessions","unit":"decimal return","allowed_roles":["selector","tree selector","linear selector","sequence selector"],"feature_schema_membership":["canonical_v2_daily_tabular_v1","canonical_v2_daily_tree_cross_sectional_v1"]},
    {"canonical_id":"predicted_momentum_60d","display_name":"Predicted momentum 60d","implementation_owner":"core.research.ml.stock_level.selector_dataset","lookback":"60 sessions","unit":"decimal return","allowed_roles":["selector","tree selector","linear selector","sequence selector"],"feature_schema_membership":["canonical_v2_daily_tabular_v1","canonical_v2_daily_tree_cross_sectional_v1"]},
    {"canonical_id":"predicted_momentum_120d","display_name":"Predicted momentum 120d","implementation_owner":"core.research.ml.stock_level.selector_dataset","lookback":"120 sessions","unit":"decimal return","allowed_roles":["selector","tree selector","linear selector","sequence selector"],"feature_schema_membership":["canonical_v2_daily_tabular_v1","canonical_v2_daily_tree_cross_sectional_v1"]},
    {"canonical_id":"predicted_volatility_20d","display_name":"Predicted volatility 20d","implementation_owner":"core.research.ml.stock_level.selector_dataset","lookback":"20 sessions","unit":"return volatility","allowed_roles":["selector","tree selector","linear selector","sequence selector","portfolio risk"],"feature_schema_membership":["canonical_v2_daily_tabular_v1","canonical_v2_daily_tree_cross_sectional_v1"]},
    {"canonical_id":"predicted_drawdown_60d","display_name":"Predicted drawdown 60d","implementation_owner":"core.research.ml.stock_level.selector_dataset","lookback":"60 sessions","unit":"fraction","allowed_roles":["selector","tree selector","linear selector","sequence selector","portfolio risk"],"feature_schema_membership":["canonical_v2_daily_tabular_v1","canonical_v2_daily_tree_cross_sectional_v1"]},
    {"canonical_id":"predicted_liquidity_score","display_name":"Predicted liquidity score","implementation_owner":"core.research.ml.stock_level.selector_dataset","source_fields":["close","volume"],"unit":"score","allowed_roles":["selector","tree selector","linear selector","sequence selector","portfolio risk"],"feature_schema_membership":["canonical_v2_daily_tabular_v1","canonical_v2_daily_tree_cross_sectional_v1"]},
    {"canonical_id":"predicted_risk_adjusted_momentum","display_name":"Predicted risk-adjusted momentum","implementation_owner":"core.research.ml.stock_level.selector_dataset","source_fields":["predicted_momentum_120d","predicted_volatility_20d"],"calculation_equation":"risk_adjusted_momentum_ratio","unit":"ratio","allowed_roles":["selector","tree selector","linear selector","sequence selector"],"feature_schema_membership":["canonical_v2_daily_tabular_v1","canonical_v2_daily_tree_cross_sectional_v1"]},
    {"canonical_id":"momentum_250d","display_name":"Momentum 250d","implementation_owner":"core.research.ml.stock_level.stock_level_alpha_features_builder","lookback":"250 sessions","unit":"decimal return","allowed_roles":["selector","tree selector","linear selector","sequence selector"],"feature_schema_membership":["canonical_v2_daily_tabular_v1","canonical_v2_daily_tree_cross_sectional_v1"]},
    {"canonical_id":"momentum_acceleration","display_name":"Momentum acceleration","implementation_owner":"core.research.ml.stock_level.stock_level_alpha_features_builder","source_fields":["multiple trailing momentum windows"],"unit":"return difference","allowed_roles":["selector","tree selector","linear selector","sequence selector"],"feature_schema_membership":["canonical_v2_daily_tabular_v1","canonical_v2_daily_tree_cross_sectional_v1"]},
    {"canonical_id":"momentum_persistence","display_name":"Momentum persistence","implementation_owner":"core.research.ml.stock_level.stock_level_alpha_features_builder","unit":"score","allowed_roles":["selector","tree selector","linear selector","sequence selector"],"feature_schema_membership":["canonical_v2_daily_tabular_v1","canonical_v2_daily_tree_cross_sectional_v1"]},
    {"canonical_id":"momentum_consistency","display_name":"Momentum consistency","implementation_owner":"core.research.ml.stock_level.stock_level_alpha_features_builder","unit":"score","allowed_roles":["selector","tree selector","linear selector","sequence selector"],"feature_schema_membership":["canonical_v2_daily_tabular_v1","canonical_v2_daily_tree_cross_sectional_v1"]},
    {"canonical_id":"relative_momentum_vs_spy","display_name":"Relative momentum versus SPY","implementation_owner":"core.research.ml.stock_level.stock_level_alpha_features_builder","source_fields":["stock close","SPY close"],"unit":"return difference","allowed_roles":["selector","tree selector","linear selector","sequence selector"],"feature_schema_membership":["canonical_v2_daily_tabular_v1","canonical_v2_daily_tree_cross_sectional_v1"]},
    {"canonical_id":"distance_from_52_week_high","display_name":"Distance from 52-week high","implementation_owner":"core.research.ml.stock_level.stock_level_alpha_features_builder","lookback":"252 sessions","unit":"fraction","allowed_roles":["selector","tree selector","linear selector","sequence selector"],"feature_schema_membership":["canonical_v2_daily_tabular_v1","canonical_v2_daily_tree_cross_sectional_v1"]},
    {"canonical_id":"drawdown_recovery_days","display_name":"Drawdown recovery days","implementation_owner":"core.research.ml.stock_level.stock_level_alpha_features_builder","unit":"sessions","allowed_roles":["selector","tree selector","linear selector","sequence selector","portfolio risk"],"feature_schema_membership":["canonical_v2_daily_tabular_v1","canonical_v2_daily_tree_cross_sectional_v1"]},
    {"canonical_id":"rolling_max_drawdown_120d","display_name":"Rolling maximum drawdown 120d","implementation_owner":"core.research.ml.stock_level.stock_level_alpha_features_builder","lookback":"120 sessions","unit":"fraction","allowed_roles":["selector","tree selector","linear selector","sequence selector","portfolio risk"],"feature_schema_membership":["canonical_v2_daily_tabular_v1","canonical_v2_daily_tree_cross_sectional_v1"]},
    {"canonical_id":"ulcer_index","display_name":"Ulcer index","implementation_owner":"core.research.ml.stock_level.stock_level_alpha_features_builder","unit":"index","allowed_roles":["selector","tree selector","linear selector","sequence selector","portfolio risk"],"feature_schema_membership":["canonical_v2_daily_tabular_v1","canonical_v2_daily_tree_cross_sectional_v1"]},
    {"canonical_id":"downside_deviation","display_name":"Downside deviation","implementation_owner":"core.research.ml.stock_level.stock_level_alpha_features_builder","unit":"return volatility","allowed_roles":["selector","tree selector","linear selector","sequence selector","portfolio risk"],"feature_schema_membership":["canonical_v2_daily_tabular_v1","canonical_v2_daily_tree_cross_sectional_v1"]},
    {"canonical_id":"volatility_percentile","display_name":"Stock volatility percentile","implementation_owner":"core.research.ml.stock_level.stock_level_alpha_features_builder","unit":"percentile","allowed_roles":["selector","tree selector","linear selector","sequence selector","regime"],"feature_schema_membership":["canonical_v2_daily_tabular_v1","canonical_v2_daily_tree_cross_sectional_v1"]},
    {"canonical_id":"volatility_trend","display_name":"Volatility trend","implementation_owner":"core.research.ml.stock_level.stock_level_alpha_features_builder","unit":"slope/ratio","allowed_roles":["selector","tree selector","linear selector","sequence selector","regime"],"feature_schema_membership":["canonical_v2_daily_tabular_v1","canonical_v2_daily_tree_cross_sectional_v1"]},
    {"canonical_id":"volatility_regime","display_name":"Stock volatility regime","implementation_owner":"core.research.ml.stock_level.stock_level_alpha_features_builder","unit":"state","allowed_roles":["selector","tree selector","linear selector","sequence selector","regime"],"feature_schema_membership":["canonical_v2_daily_tabular_v1","canonical_v2_daily_tree_cross_sectional_v1"]},
    {"canonical_id":"ATR_percentile","display_name":"ATR percentile","implementation_owner":"core.research.ml.stock_level.stock_level_alpha_features_builder","source_fields":["high","low","close"],"unit":"percentile","allowed_roles":["selector","tree selector","linear selector","sequence selector","portfolio risk"],"feature_schema_membership":["canonical_v2_daily_tabular_v1","canonical_v2_daily_tree_cross_sectional_v1"]},